{"$schema":"https://json-schema.org/draft/2020-12/schema","$id":"https://raw.githubusercontent.com/mikelninh/openaction/main/spec/1.0/openaction.schema.json","title":"OpenAction Core 1.0 RC1","description":"Provider-neutral contract for evidence-linked, permission-aware actions with explicit approval and outcome semantics.","type":"object","additionalProperties":false,"required":["openaction","id","kind","label","status","reason","actor","evidence","risk","permissions","approval","created_at"],"properties":{"openaction":{"const":"1.0-rc1"},"id":{"type":"string","pattern":"^oa_[A-Za-z0-9._-]+$"},"case_id":{"type":"string","maxLength":200},"kind":{"type":"string","pattern":"^[a-z0-9]+(?:[._-][a-z0-9]+)+$"},"label":{"type":"string","minLength":1,"maxLength":240},"status":{"enum":["proposed","ready","approved","executing","succeeded","failed","cancelled","expired"]},"reason":{"type":"string","minLength":1,"maxLength":1200},"actor":{"$ref":"#/$defs/actor"},"target":{"$ref":"#/$defs/actor"},"inputs":{"type":"object"},"deadline":{"type":"string","format":"date-time"},"created_at":{"type":"string","format":"date-time"},"updated_at":{"type":"string","format":"date-time"},"evidence":{"type":"array","minItems":1,"items":{"$ref":"#/$defs/evidence"}},"risk":{"enum":["low","medium","high","critical"]},"permissions":{"type":"array","items":{"$ref":"#/$defs/permission"}},"approval":{"$ref":"#/$defs/approval"},"reversible":{"type":"boolean"},"idempotency_key":{"type":"string","minLength":8,"maxLength":200},"outcome":{"$ref":"#/$defs/outcome"},"correlation_id":{"type":"string","maxLength":200},"extensions":{"type":"object"}},"allOf":[{"if":{"properties":{"risk":{"enum":["high","critical"]}},"required":["risk"]},"then":{"properties":{"approval":{"properties":{"required":{"const":true},"mode":{"enum":["human","qualified_human"]}}}}}},{"if":{"properties":{"status":{"enum":["approved","executing","succeeded"]}},"required":["status"]},"then":{"properties":{"approval":{"properties":{"status":{"const":"approved"}}}}}}],"$defs":{"actor":{"type":"object","additionalProperties":false,"required":["type","id"],"properties":{"type":{"enum":["human","qualified_human","agent","service","institution"]},"id":{"type":"string","minLength":1,"maxLength":200},"display_name":{"type":"string","maxLength":200},"identity_provider":{"type":"string","maxLength":300}}},"evidence":{"type":"object","additionalProperties":false,"required":["id","kind","source"],"properties":{"id":{"type":"string","pattern":"^ev_[A-Za-z0-9._-]+$"},"kind":{"enum":["document","message","database","observation","policy","person","system","other"]},"source":{"type":"string","minLength":1,"maxLength":300},"excerpt":{"type":"string","maxLength":500},"uri":{"type":"string","format":"uri"},"locator":{"type":"string","maxLength":300},"observed_at":{"type":"string","format":"date-time"},"sha256":{"type":"string","pattern":"^[a-fA-F0-9]{64}$"},"sensitivity":{"enum":["public","internal","personal","sensitive","highly_sensitive"]},"retention_hint":{"type":"string","maxLength":200}}},"permission":{"type":"object","additionalProperties":false,"required":["capability","resource","purpose","effect"],"properties":{"capability":{"type":"string","pattern":"^[a-z0-9]+(?:[._-][a-z0-9]+)+$"},"resource":{"type":"string","minLength":1,"maxLength":300},"purpose":{"type":"string","minLength":1,"maxLength":300},"effect":{"enum":["read","propose","write","execute"]},"sensitivity":{"enum":["public","internal","personal","sensitive","highly_sensitive"]},"constraints":{"type":"array","items":{"type":"string","maxLength":300}}}},"approval":{"type":"object","additionalProperties":false,"required":["required","mode","status"],"properties":{"required":{"type":"boolean"},"mode":{"enum":["none","policy","human","qualified_human"]},"status":{"enum":["not_required","pending","approved","rejected","revoked","expired"]},"receipt_id":{"type":"string","pattern":"^oar_[A-Za-z0-9._-]+$"},"expires_at":{"type":"string","format":"date-time"},"conditions":{"type":"array","items":{"type":"string","maxLength":500}}}},"outcome":{"type":"object","additionalProperties":false,"required":["status","summary"],"properties":{"status":{"enum":["succeeded","failed","partial","unknown"]},"summary":{"type":"string","minLength":1,"maxLength":1000},"completed_at":{"type":"string","format":"date-time"},"receipt":{"type":"string","maxLength":500},"metrics":{"type":"object","additionalProperties":{"type":["number","integer","string","boolean","null"]}}}}}}