{"openaction":"1.0-rc1","id":"oa_careos_followup_001","case_id":"case_synthetic_001","kind":"health.follow_up.review","label":"Review discharge follow-up","status":"ready","reason":"Synthetic discharge task requires accountable follow-up review.","actor":{"type":"service","id":"careos-demo"},"created_at":"2026-08-24T09:30:00Z","evidence":[{"id":"ev_task_001","kind":"system","source":"synthetic-fhir","locator":"Task/001","sensitivity":"internal"}],"risk":"high","permissions":[{"capability":"health.follow_up.propose","resource":"Task/001","purpose":"prepare follow-up for clinician review","effect":"propose","sensitivity":"internal"}],"approval":{"required":true,"mode":"qualified_human","status":"pending"},"reversible":true,"idempotency_key":"case_synthetic_001_followup"}